{
  "version": 1,
  "adapter": "browser",
  "enabled": true,
  "required_environment": [],
  "redact_environment": [],
  "checks": [
    {
      "id": "critical-user-journeys",
      "type": "command",
      "required": true,
      "executable": "npm.cmd",
      "arguments": ["run", "check"],
      "working_directory": ".",
      "expected_exit_code": 0,
      "timeout_seconds": 600
    }
  ]
}
